{
  "sampleId": "ai_app_dev_004",
  "jobId": "ai_app_dev",
  "source": "boss",
  "sourceUrl": "https://www.zhipin.com/job_detail/86de1011bd6e4af50nVy0926FFpY.html?securityId=Tm5JWHtUCsSON-51aJGTZm4u-7A87zdcIRWSLCXa1QsMOmmvpWCSLE4P058gsb-0paU9WdNNK4_rTVvEJ60_7gCMHfs1ZoDGzAAwmS4HlgP5NLSWXu_JGoXpPBEBEDCRFrz08MlrQfrrR_lnyYcMjkfpkBI2RnEErn6jRvy09RypUiZKOb-Sw_gGsztOe-AYIHDlRsmX-N-dcfHYenOmj0kiHRLEWox_IMWapq_c99Bcan2Qy7IHwdDbvNC1L2-CDeG-zamH87tXS5d_KVn6FgVo3vXdDTHv3kavqz8g3qQw3rRGZ5xV8XmVoko7RWrsCVnwiB9wdMdBDtFzu80ojfLDmYtFcoYYeli3IrhnXSmkdB2NsOewaMxGHxrn4p1Ef_eC-sBYzG9tEyudtJAyama_N1viKKXf4OI~&ka=company_more_job_86de1011bd6e4af50nVy0926FFpY",
  "crawledAt": "2026-08-28",
  "title": "AI开发",
  "company": "勤为径科技",
  "level": "junior",
  "rawText": "一、岗位职责\n1、熟练运用AI自媒体工具及通用AI工具，掌握AI软件应用所需的下载获取操作，能独立落地自身负责领域的AI工\n具运用，提升工作效率与产出质量。\n2、持续关注全球AI行业最新动态、技术迭代及应用趋势，主动研究AI工具的新功能、新玩法，探索其在实际工作\n中的落地场景。\n3、若熟悉OpenClaw用法或开源自能体运用，需负责将其应用于贸易、跨境电商、自媒体等业务场景，挖掘AI对业\n务的赋能价值。\n4、日常运用AI工具完成商业全闭环，包括但不限于内容创作、客户对接、需求挖掘、流程优化等，助力业务目标\n达成。\n5、整理AI工具使用经验、应用案例，形成可复用的方法，推动团队AI应用能力提升。\n二、任职要求\n1、核心要求：熟悉AI自媒体工具、通用AI工具的操作，具备AI软件应用所需的获取运用能力，能独立实施特定领\n域的AI工具运用。\n2、兴趣与态度：对AI技术抱有极高热情，具备强烈的主动学习意识，时刻关注AI行业最新动态，愿意持续投入时\n间研究AI工具及应用。\n3、加分项：熟悉OpenClaw用法，或有开源自能体运用经验，且能将其应用于贸易、跨境电商、自媒体任一领域者\n优先。\n3、能力要求：具备商业思维，能熟练运用AI工具打通商业闭环，解决实际业务问题；具备较强的探索能力和问题\n解决能力，善于总结经验。\n3、学历与经验：大专及以上学历，有无相关工作经验均可，优先考虑有AI工具商业应用经验者。\n4、其他：具备良好的沟通能力和执行力，工作认真负责，能快速适应A技术的更新迭代。",
  "crawlMethod": "manual",
  "extracted": {}
}