{
  "sampleId": "ai_product_007",
  "jobId": "ai_product",
  "source": "boss",
  "sourceUrl": "unknown",
  "crawledAt": "2026-08-28",
  "title": "AI产品经理（AI Native 创新方向）",
  "company": "AI Native 0-1创新孵化团队",
  "level": "unknown",
  "rawText": "1.直属 CEO 傅盛，独立推进 AI 原生产品从 0 到 1；\n2.不在传统业务线框架内，专注前瞻性 AI 方向；\n3.快速验证创新想法，真正做「AI原生」而非传统产品加AI；\n\n岗位职责：\n1.独立推进 AI 原生产品从 0 到 1 落地；\n2.快速验证 CEO 提出的 AI 创新方向，输出可验证的产品方案；\n3.熟悉主流大模型及应用场景，将技术转化为产品；\n4.与团队高频交流 AI 产品使用心得，推动团队 AI 能力提升。\n\n职位要求：\n必须具备：\n1.1-2 年工作经验；\n2.有实际 AI 产品项目经历（能说清楚自己做过什么、怎么做的、结果如何）；\n3.具备 AI 原生产品思维，能从用户需求出发设计产品；\n4.熟悉主流大模型（GPT/Claude/Gemini/DeepSeek 等）及常见应用场景；\n5.自驱力强，具备“AI 特种兵”素质；\n\n加分项：\n1.有独立上线过 AI 产品的经历；\n2.能用 AI coding 工具（Cursor/v0 等）搭建原型；\n3.参加过 AI 黑客松并有实际产出；\n4.对大模型技术有一定深度理解。",
  "crawlMethod": "manual",
  "extracted": {}
}