{
  "sampleId": "ai_ui_design_011",
  "jobId": "ai_ui_design",
  "source": "boss",
  "sourceUrl": "unknown",
  "crawledAt": "2026-08-28",
  "title": "用户体验研究实习生（设计方向）",
  "company": "小红书",
  "level": "unknown",
  "rawText": "工作职责1. 参与用户体验及创作者运营相关项目的平面设计工作，包括活动主视觉、海报、Banner、长图、H5等；2. 参与团队传播专项，以手绘、插画、漫画等形式将抽象概念和用户洞察转化为可视化传播内容；3. 协助完成日常设计需求，包括但不限于数据报告美化、活动物料制作、内部宣传素材设计；4. 承接团队其他设计协作需求，配合项目节奏快速响应。任职资格1. 本科或研究生在读，视觉传达、插画、美术、设计等艺术类相关专业优先；2. 美术功底扎实，有较强手绘能力，有插画或漫画创作经验者优先；3. 熟练使用PS、AI、Sketch等主流设计软件，掌握C4D、AE等动效/三维软件者加分；4. 有良好的创意感知和视觉审美，能将业务需求转化为有温度的设计表达；5. 沟通顺畅，执行力强，能在项目节奏中快速响应并与团队高效协作；6. 每周实习4天及以上，实习期不低于3个月，能尽快到岗者优先；7. 投递简历请附作品集，需包含手绘或插画作品。",
  "crawlMethod": "manual",
  "extracted": {}
}