{
  "sampleId": "ai_app_dev_007",
  "jobId": "ai_app_dev",
  "source": "boss",
  "sourceUrl": "「ai全栈开发（2027届校招）招聘」_差旅壹号招聘-BOSS直聘",
  "crawledAt": "2026-08-28",
  "title": "AI全栈开发",
  "company": "差旅壹号",
  "level": "junior",
  "rawText": "毕业时间：2027 年\n岗位职责：\n负责差旅壹号各产品线的ai全栈开发工作\n负责差旅壹号各产品线的技术提升、性能优化；\n学习掌握及使用a编程、开发常见框架、中间件，参与研究新兴技术，对产品进行持续优化。\n岗位要求：\n2027届应届毕业生，全日制统招一本及以上学历，计算机相关专业优先；\n熟悉Java、SpringCloud，熟悉Redis、MQ等主流中间件的使用；\n熟悉数据结构、网络编程和多线程编程；\n掌握MySQL、SQLServer等主流数据库的一种或多种；\n热爱互联网，对服务器端的技术有浓厚的兴趣，热衷于技术突破与创新；\n熟练掌握svn或git，对云原生、K8S有了解及使用；\n具有良好的沟通能力和团队合作精神、优秀的分析问题和解决问题的能力；\n实习薪资220/天，实习期间提供提供免费的晚餐和住宿",
  "crawlMethod": "manual",
  "extracted": {}
}