{
  "sampleId": "ai_ui_design_008",
  "jobId": "ai_ui_design",
  "source": "boss",
  "sourceUrl": "unknown",
  "crawledAt": "2026-08-28",
  "title": "UI设计实习生",
  "company": "叠纸游戏",
  "level": "unknown",
  "rawText": "岗位职责：1.支持游戏UI相关的设计工作，比如设定游戏界面视觉创意风格、按照已定界面风格的原形标准，完成各级界面设计等；2.支持游戏内其他的设计工作，包括但不限于：游戏图标、平面设计等。任职要求：1.本科及以上学历，视觉或艺术类等相关专业优先，必须为在校学生。每周需出勤至少三天，至少实习三个月以上；2.熟练掌握PS、AI等设计工具；3.具备一定的视觉设计能力和图形创意能力，对色彩、构图感知力强，审美优秀；4.对游戏行业或ACG相关有浓厚兴趣者优先；5.良好的沟通协作能力和抗压能力，责任心强。加分项有以下行业经验：游戏",
  "crawlMethod": "manual",
  "extracted": {}
}