{
  "sampleId": "ai_data_eval_001",
  "jobId": "ai_data_eval",
  "source": "company_site",
  "sourceUrl": "https://careers.tencent.com/",
  "crawledAt": "2026-08-28",
  "title": "微信基础-大模型评测产品经理",
  "company": "腾讯",
  "level": "unknown",
  "rawText": "岗位职责：\n1. 评测体系设计：主导 AI 产品的评测体系搭建，定义评测维度、指标、标准和流程，确保评测的科学性和全面性；\n2. 评测方法论制定：设计适配不同场景（对话、工具调用、多轮交互、创意生成等）的评测方案，包括自动评测、人工评测、众包评测、竞品对比等；\n3. 评测平台产品设计：规划评测平台的产品架构和功能模块，输出 PRD，驱动研发团队落地；\n4. 评测洞察与决策支持：深度分析评测数据，发现产品体验问题和模型能力短板，输出有洞察力的评测报告，推动产品和算法团队优化；\n5. 竞品评测与行业跟踪：持续跟踪业界竞品的能力变化，建立常态化竞品评测机制；\n6. 标注体系管理：设计标注规范和质量控制流程，确保评测数据质量。",
  "crawlMethod": "auto",
  "extracted": {}
}