{
  "sampleId": "ai_product_010",
  "jobId": "ai_product",
  "source": "boss",
  "sourceUrl": "unknown",
  "crawledAt": "2026-08-28",
  "title": "ai产品经理",
  "company": "北京荆华密算科技",
  "level": "unknown",
  "rawText": "职位详情：C端产品、熟悉AI产品、AI产品、0-1产品经验\n\n职位描述：\n1. 产品规划：深入研究 AI 相关技术趋势、市场动态、用户体验和真实用户需求，制定具有前瞻性和竞争力的 ToC 密态AI应用产品战略与规划，明确产品定位、目标用户、核心场景及发展路径。\n2. 用户洞察与需求创造\n从用户真实场景、使用习惯、隐私焦虑和业务痛点出发，识别用户已经表达和尚未明确表达的需求，判断什么需求值得做、为什么做、如何做，并将其转化为清晰的产品方向和功能设计。\n能够站在用户视角思考 AI 产品的使用门槛、信任感、安全感和体验流畅度，推动产品从“技术可用”走向“用户愿意用、持续用、信任用”。\n3. 解决方案设计\n创造用户需求和业务场景，设计安全隐私类产品方案，包括产品架构、业务流程、人机交互逻辑、AI 能力调用路径和安全体验表达方式。\n重点关注如何把密态计算、安全保护、AI 推理等底层能力，转化为用户能理解、能感知、能信任的产品体验。\n4. 产品设计与体验打磨\n将解决方案转化为高质量产品设计，输出产品定义、PRD和原型、交互方案。关注产品体验、交互路径、视觉质感和用户感受，打造易用、高效、有安全感、有品质感的密态 AI 应用产品，持续提升产品整体体验和产品品味。\n\n任职要求：\n1. 产品经验\n具备 ToC AI 应用产品设计经验，能够从市场刚需和用户价值出发，构建与隐私保护、数据安全、效率提升强相关的垂类 AI 应用产品。\n2. 产品品味与用户体验能力\n具备较强的产品品味和用户体验判断力，对交互细节、信息表达、用户感受和产品质感敏感，能够判断一个产品是否好用、可信、高级、可持续使用。\n能理解用户，不只是收集用户需求，而是能够判断用户背后的真实动机、使用场景和潜在需求，并将其转化为产品机会。\n3. 数据分析与 bad case 迭代\n能够通过分析 bad case、用户反馈和使用数据，定位用户问题根源，并主导解决方案的实施，保证密态 AI 应用产品交互的准确性，提供优秀的用户体验。\n4. 学习能力\n对 AI 技术发展有强烈好奇心与学习热情，能够快速掌握新知识、新技能，适应不断变化的技术环境；同时能够持续学习和理解安全、隐私、密态计算相关知识，并将安全理念体现在密态 AI 应用产品中。",
  "crawlMethod": "manual",
  "extracted": {}
}