{
  "sampleId": "ai_app_dev_002",
  "jobId": "ai_app_dev",
  "source": "company_site",
  "sourceUrl": "https://jobs.bytedance.com/experienced/position/7323089843444599091/detail",
  "crawledAt": "2026-08-28",
  "title": "豆包AI大模型产品解决方案架构师-火山方舟",
  "company": "字节跳动",
  "level": "unknown",
  "rawText": "职位描述：\n团队介绍：火山方舟是火山引擎推出的一站式大模型服务平台，提供模型推理、评测、精调等全流程服务，搭载豆包及业界主流大模型，提供丰富的插件生态和 AI 应用开发服务。\n\n岗位职责：\n1. 在各领域、各场景制定火山方舟的解决方案，并进行商业化落地；\n2. 对外负责与业务拓展部门紧密合作，共同推进产品及解决方案拓展/销售过程，包括方案交流、需求分析、解决方案设计、商务合同签订、项目交付、项目验收等；\n3. 对内负责与产品及研发部门沟通协调，促进解决方案落地及产品迭代，包括商务模式、项目进度、产品及服务交付等。\n\n职位要求：\n1. 本科及以上学历，计算机、通信、人工智能等相关专业优先；\n2. 5 年以上 AI to B 解决方案或项目管理工作经验，独立运作过项目解决方案；\n3. 具备良好的项目管理能力及组织协调能力，数字导向；\n4. 了解生成式人工智能的最新行业动态、应用方向，对生成式人工智能短、中、长期在各领域落地的路径和可行性有自己的判断。",
  "crawlMethod": "auto",
  "extracted": {}
}