{
  "sampleId": "ai_ops_008",
  "jobId": "ai_ops",
  "source": "boss",
  "sourceUrl": "unknown",
  "crawledAt": "2026-08-28",
  "title": "产品生态经理（协会&开发者社区）",
  "company": "清微智能",
  "level": "mid",
  "rawText": "AI产品岗位定位围绕公司云端芯片生态战略，负责国内外开发者生态体系的搭建与精细化运营，主导开发者社区运维、开源社区对接、高校产学研合作、开发者赛事与活动策划等核心工作；通过构建活跃、健康的开发者生态，提升公司芯片产品的开发者调用量、技术口碑与行业影响力，为公司产品的技术迭代、场景落地与市场拓展提供开发者生态支撑。岗位职责1、开发者社区体系搭建与精细化运营- 负责公司官方开发者社区的整体规划、搭建、日常运维与内容运营，制定社区运营规则、内容体系、用户成长体系与激励机制；- 输出高质量的技术文档、开发教程、最佳实践、案例分享等内容，降低开发者使用门槛，提升社区活跃度与用户粘性；- 负责社区用户的日常对接、需求响应、问题解答，搭建开发者反馈闭环，推动产品与技术的持续优化。2、开源生态对接与深度运营- 调研梳理国内外云计算、芯片、AI、大数据领域的主流开源社区与顶级开源项目，完成目标社区的分级分类与合作规划；- 负责主流开源社区的深度对接，推动公司产品与开源项目的兼容性适配、技术贡献、社区布道，提升公司在开源领域的影响力；- 策划开源社区的联合活动、技术沙龙、线上直播、代码贡献挑战赛等，吸引国内外开发者参与，扩大公司技术品牌曝光。3、高校产学研合作与人才培养- 负责国内重点高校、科研院所的对接与合作，搭建产学研合作体系，推动联合实验室、人才培养基地、实习实训基地的落地；4、开发者赛事与品牌活动策划落地- 负责开发者大赛、编程挑战赛、应用创新大赛等赛事的整体策划、筹备、落地与复盘，打造行业一流开发者赛事IP；- 联合行业头部企业、开源社区、高校、投资机构等，共同策划开发者峰会、技术论坛、开源大会等行业顶级活动，提升公司行业话语权；- 负责活动的嘉宾对接、议题策划、宣传推广、报名组织、现场执行等全流程工作，保障活动顺利落地，最大化品牌传播效果。5、开发者生态数据运营与策略优化- 搭建开发者生态数据监测体系，持续追踪开发者数量、活跃度、调用量、留存率、社区内容产出等核心指标；- 定期输出开发者生态运营分析报告，复盘运营效果，识别问题与机会点，优化运营策略与资源投入；- 调研行业内头部企业的开发者生态运营模式与最佳实践，结合公司业务特点，持续迭代优化公司开发者生态体系。任职要求1、本科及以上学历，计算机、电子信息、自动化、软件工程、人工智能等相关专业优先；2、有5年及以上IT / 互联网 / 芯片行业开发者生态运营、开源社区运营、高校合作、技术品牌营销相关工作经验；3、熟悉云计算、芯片、AI、大数据领域的主流开源社区、开源项目与开发者生态，有开源社区贡献、技术布道、开发者赛事策划落地经验者优先；4、具备优秀的项目管理、活动策划、内容运营与跨部门协同能力，能够独立推动大型开发者活动与合作项目落地；5、具备敏锐的行业洞察力与开发者视角，熟悉开发者群体的需求与行为特征，能够制定针对性的运营策略；6、具备良好的文案撰写、公众表达与沟通协调能力，有技术博客、开源项目贡献、行业演讲经验者优先。",
  "crawlMethod": "manual",
  "extracted": {}
}