{
  "sampleId": "ai_product_011",
  "jobId": "ai_product",
  "source": "boss",
  "sourceUrl": "unknown",
  "crawledAt": "2026-08-28",
  "title": "AI产品经理（24-25届毕业）",
  "company": "飞鹤集团",
  "level": "unknown",
  "rawText": "职位详情：C端产品、用增产品\n\n一、核心工作职责\n1. 负责AI整体产品规划、架构设计、版本迭代与上线落地，结合大模型、AIGC、智能交互等前沿技术，搭建差异化AI产品形态，定义公司AI业务的产品方向与核心壁垒。\n2. 承担业务商业化核心目标，负责产品付费体系、增值服务、智能转化场景的整体规划与迭代，设计用户价值挖掘、精准转化、付费拉升的产品策略，实现AI产品可持续商业化闭环与业务增收。\n3. 搭建产品数据、用户行为、转化效果、算法体验完整评估体系，基于数据持续复盘、优化产品策略、场景玩法与增长路径，实现产品体验与商业效果持续迭代升级。\n\n二、岗位核心价值\n1. 负责公司AI战略，定义产品、定义业务、定义商业化模式，拥有完整业务话语权。\n2. 作为产品经理深度参与公司战略决策，全程主导项目从立项、搭建、迭代到商业化成熟的完整生命周期。",
  "crawlMethod": "manual",
  "extracted": {}
}