{
  "sampleId": "ai_ops_004",
  "jobId": "ai_ops",
  "source": "boss",
  "sourceUrl": "unknown",
  "crawledAt": "2026-08-28",
  "title": "AI产品运营",
  "company": "嘉兴江莱科技有限公司",
  "level": "unknown",
  "rawText": "1、负责金融科技相关产品的需求调研、市场分析、用户痛点挖掘，独立完成产品规划、原型设计、需求文档撰写，输出完整的产品方案。2、参与产品从0到1落地优化、迭代升级全流程，联动研发、测试、运营、业务等跨部门团队，推进需求评审、开发落地地、测试验收、上线复盘，保障产品项目高效落地。3、运用各类AI工具赋能产品工作与项目落地，借助AI工具完成需求分析、用户画像梳理、数据分析、方案优化、原型辅助设计、内容产出、风险预判等工作，提升产品设计效率与项目推进质量，落地AI+金融产品创新优化场景。4、持续跟踪金融科技行业政策、市场动态、竞品产品迭代情况，结合业务数据及用户反馈，持续优化产品功能、流程及体验，提升产品核心竞争力与业务转化效率。5、负责产品数据监控、复盘分析，定期输出产品迭代报告、项目工作总结，沉淀产品方法论与项目落地经验。6、配合业务部门完成产品推广、落地赋能，解答业务使用问题，助力业务数字化、智能化升级。任职要求：1、学历要求:硕士及以上学历，金融、统计学、数据分析、经济学等相关专业优先。2、综合能力:具备良好的跨部门沟通协调能力、项目推进能力、问题解决能力，思维清晰、逻辑严谨，对数据敏感，有较强的产品运营思维和创新意识。3、职业素养:工作认真负责、执行力强，具备良好的抗压能力和团队协作意识，认同金融科技行业发展方向，愿意深耕产品领域。",
  "crawlMethod": "manual",
  "extracted": {}
}