{
  "sampleId": "ai_product_005",
  "jobId": "ai_product",
  "source": "boss",
  "sourceUrl": "unknown",
  "crawledAt": "2026-08-28",
  "title": "【2027届秋招】AI产品经理",
  "company": "游戏AI方案与产品团队",
  "level": "unknown",
  "rawText": "奖金绩效：2-4个月\n职位详情：校招\n毕业时间：2026年-2027年\n招聘截止时间：2026.10.31\n\n【岗位职责】\n1、负责游戏方案设计相关业务的AI需求场景挖掘与应用落地，包括用户调研、竞品分析、AI技术可行性分析、产品规划、产品设计、项目管理、数据分析等；\n2、对产品体验、落地效果、产品价值负责，深入了解公司业务与算法技术，持续推动产品迭代；\n3、对接战略研究、策划、运营、用户研究、各项目组、研究小组、算法工程师等各方业务，确保产品实施、项目跟进与落地应用。\n\n【任职要求】\n- 2027年应届生，本科及以上学历，人工智能、软件开发、产品设计、游戏设计、心理学等相关专业优先；\n- 对AI领域有基本认知、理解和思考，熟悉市场上主要的大模型产品，对技术可行性的边界有所认知；\n- 具备敏锐的产品思维、团队合作沟通能力与一定的抗压能力，能在具有一定挑战性的目标和节奏下推动项目前进；\n- 熟悉Axure、Figma、Sketch等常用产品设计工具；\n- 有AI产品/产品经理相关产品实习经验优先。",
  "crawlMethod": "manual",
  "extracted": {}
}