{
  "sampleId": "ai_data_eval_007",
  "jobId": "ai_data_eval",
  "source": "boss",
  "sourceUrl": "https://www.zhipin.com/job_detail/e08ad41787ba597c0nJz3d-4F1RY.html?securityId=Ui7CPOLjiB_Di-81dIokQqDHKkgf0hUXpYNY4oHLnHA6OeAY7k9Gy7B3apNDtK4iB17yoKrnzhFcDxQi6twl4rzXJUcnMr-Awq4Y69LExjxoEC7ege3ugmJdubzJPIaZRFYbLHJGiX04dB8c1rTq7rDwQT3KxH-fjdgAaIL2qeU-UEft5fAnx9vjf3D507Hw8KZ-yY4_TQvgevPJC00W1_jZCUO9SVmH3J1Td-PIGCS-b9Sm5fwSvOtOu_OK29Ju795iivXI7sd7_vPWuZbN5cfAeqhAwCSwvNNiXuoKqY1GLelEnTgdar4-JbwjGAXZPdhXJgCuVXZfbuiIEJ37GChxD6scH7LqmJ5jtYEN8uDjEiW353xYEqCazQX39LCo_b1u2R43nw~~&ka=company_more_job_e08ad41787ba597c0nJz3d-4F1RY",
  "crawledAt": "2026-08-28",
  "title": "AI产品评测岗+六险一金+双休",
  "company": "深圳易宝软件有限公司",
  "level": "junior",
  "rawText": "岗位概述：负责协助模型评测运营工作，包括评测数据集的设计与维护、评测结果的抽检校验、产品问题的跟踪与分析，确保模型输出质量达标并持续推动效果迭代。【岗位职责】1. 参与评测数据集的设计、搭建与日常维护，覆盖创作、知识问答、文档理解、生图等多场景，保障评测集的完整性和时效性；2. 对评测团队产出的标注数据和评测结果进行抽检校验，识别打分偏差，推动评测标准对齐，确保初标-质检-验收全流程质量一致；3. 跟踪并处理客户方及内部在产品问题平台上发起的问题反馈，完善问题标签分类体系，定期输出问题分析报告，为策略迭1. 代提供数据支撑；2. 探索并落地自动化评测或数据处理工具，提升评测效率和数据流转速度。【岗位要求】1. 本科及以上学历，具备大模型评测或AI产品相关工作经验；2. 熟悉模型评测流程与方法*，对内容质量有高度敏感度，能够独立判断模型输出在准确性、表达质量、安全性等维度的表现是否达标；3. 具备产品思维和产品运营经验*，能从用户视角审视模型效果，在产品侧形成有效补位；4. 逻辑清晰，做事细致有条理，具备良好的跨团队沟通协调能力；5. 有自动化提效意识或实践经验（如脚本编写、数据处理工具使用等）者优先。”",
  "crawlMethod": "manual",
  "extracted": {}
}