{
  "sampleId": "ai_ui_design_006",
  "jobId": "ai_ui_design",
  "source": "boss",
  "sourceUrl": "unknown",
  "crawledAt": "2026-08-28",
  "title": "UI设计师",
  "company": "美团",
  "level": "unknown",
  "rawText": "【岗位职责】1、负责美团外卖C端核心战略新业务的UI界面设计，为新功能、新产品提供创意及设计方案；2、参与产品讨论，与产品经理、工程师协作，从视觉设计和用户体验的角度提出建议与解决方案；3、配合工程师共同创建用户界面，跟踪产品效果，保证最终设计质量；4、持续关注设计趋势，分享设计经验，推动提高团队的设计能力。【岗位需求】1、大学本科以上学历，有3年以上的正式工作经验，并且有大型互联网公司的上线落地项目。2、具有出色的设计表现能力，能迅速有效的将想法表现为设计方案。3、具有独立思考、自驱意识与创作能力、优秀的内外部沟通能力。4、有直播或视频设计经验的优先。5、简历请附上作品集。具备以下者优先1、视觉表现力好非常重要；2、有直播或视频设计经验的优先。【岗位亮点】1、美团外卖C端核心战略新业务，发展空间大；2、公司成熟的设计知识体系和培养体系，更好地支持个人成长；3、团队内学习氛围强和分享机制，有助于不断提升专业能力。",
  "crawlMethod": "manual",
  "extracted": {}
}