{
  "sampleId": "ai_product_008",
  "jobId": "ai_product",
  "source": "boss",
  "sourceUrl": "unknown",
  "crawledAt": "2026-08-28",
  "title": "AI平台产品经理",
  "company": "模式星河",
  "level": "unknown",
  "rawText": "3. 开放包容：团队氛围极佳。我们是一个热情、乐观且包容的集体，团队平均年龄25岁。没有复杂的层级隔阂，致力于打造一个技术与职能相互成就、共同发挥价值的平台。\n\n【你将负责】\n- 负责 human-in-loop 平台的核心产品规划、架构设计与落地，抽象平台核心功能与架构\n- 负责专家网络从招募、入驻、作业、评估、结算全流程的用户地图与交互设计，持续优化平台用户体验\n- 建立产品体验反馈与迭代机制，持续优化产品\n\n【职位要求】\n我们期望你\n- 聪明、逻辑性强、学习速度快，面对模糊问题不焦虑，能自己定义问题、拆解并推进\n- 出色的产品体验设计天赋和品味——对“好用”和“难用”的差别极度敏感，能把复杂的流程设计得清晰、顺手\n- AI native：深度使用 AI 工具，理解 LLM、数据飞轮、评测与对齐的基本逻辑\n- 能利用 vibecoding 做出可交互的 demo，不完全依赖研发也能验证想法\n\n【加分项】\n- 接触过数据标注 / RLHF / 评测 / 众包或 marketplace 类平台\n- 有个人 vibecoding 作品\n- 有平台类产品的实习、工作经验",
  "crawlMethod": "manual",
  "extracted": {}
}